{
  "schema_version": "v1",
  "id": "federated-team-incident",
  "title": "A distributed team onboards, collaborates, and resolves an incident",
  "required_topology": "federated",
  "intent": "Prove that people attached to two isolated principal servers can discover each other, collaborate through the visible product, survive interruption, and preserve authorization boundaries without the agent relying on hidden mutation APIs.",
  "source_flows": [
    "registration-pcr-genesis",
    "ordinary-realm-creation",
    "realm-invitation-history-bootstrap",
    "message-authoring-seal-sync",
    "realm-event-server-fanout",
    "service-route-authentication-and-relocation",
    "service-route-discovery-handover-and-repair"
  ],
  "actors": [
    {
      "id": "alice",
      "site": "alpha",
      "role": "team administrator and incident commander"
    },
    {
      "id": "chrid",
      "site": "alpha",
      "role": "local engineer"
    },
    {
      "id": "bob",
      "site": "beta",
      "role": "federated engineer"
    },
    {
      "id": "david",
      "site": "beta",
      "role": "uninvited external user"
    }
  ],
  "agent_constraints": {
    "mutation_surface": "visible-ui-only",
    "read_only_oracles_allowed": true,
    "max_attempts_per_checkpoint": 3,
    "allow_testid_locators": false,
    "allow_dom_eval_for_actions": false,
    "require_semantic_snapshot_before_action": true
  },
  "checkpoints": [
    {
      "id": "J01",
      "actor": "harness",
      "phase": "topology",
      "goal": "Verify alpha and beta are distinct principal servers with separate identities, state roots, object roots, and browser origins.",
      "required": true,
      "hard_checks": [
        "alpha-beta-base-url-distinct",
        "alpha-beta-service-id-distinct",
        "alpha-beta-state-root-distinct",
        "alpha-beta-object-root-distinct",
        "alpha-beta-browser-origin-distinct"
      ]
    },
    {
      "id": "J02",
      "actor": "alice",
      "phase": "onboarding",
      "goal": "Register or sign in through alpha's visible UI and reach an authenticated home surface.",
      "required": true,
      "hard_checks": [
        "alice-authenticated-on-alpha",
        "no-secret-in-evidence"
      ]
    },
    {
      "id": "J03",
      "actor": "bob",
      "phase": "onboarding",
      "goal": "Register or sign in independently through beta's visible UI and reach an authenticated home surface.",
      "required": true,
      "hard_checks": [
        "bob-authenticated-on-beta",
        "alice-bob-browser-state-isolated"
      ]
    },
    {
      "id": "J04",
      "actor": "alice",
      "phase": "workspace",
      "goal": "Create a private team Realm named for the run, invite local engineer Chrid and federated engineer Bob, and publish a welcome message.",
      "required": true,
      "hard_checks": [
        "realm-created",
        "welcome-visible-to-alice",
        "invite-targets-correct"
      ]
    },
    {
      "id": "J05",
      "actor": "chrid",
      "phase": "local-collaboration",
      "goal": "Discover the invitation without a direct URL, accept it, find the welcome context, and reply with a local status update.",
      "required": true,
      "hard_checks": [
        "chrid-member-visible",
        "chrid-reply-visible"
      ]
    },
    {
      "id": "J06",
      "actor": "bob",
      "phase": "federated-collaboration",
      "goal": "Discover the cross-server invitation without a direct URL, accept it, and reply to Alice's welcome message.",
      "required": true,
      "hard_checks": [
        "bob-member-converged-on-alpha",
        "bob-member-converged-on-beta",
        "bob-reply-visible-on-beta"
      ]
    },
    {
      "id": "J07",
      "actor": "alice",
      "phase": "federated-collaboration",
      "goal": "Observe Bob's federated reply, acknowledge it, and verify the conversation makes actor and server context understandable.",
      "required": true,
      "hard_checks": [
        "bob-reply-visible-on-alpha",
        "alice-ack-visible"
      ]
    },
    {
      "id": "J08",
      "actor": "alice",
      "phase": "incident",
      "goal": "Open a SEV-2 incident discussion, describe checkout latency impact, and ask Bob to diagnose while Chrid prepares a customer-safe update.",
      "required": true,
      "hard_checks": [
        "incident-message-visible",
        "role-requests-visible"
      ]
    },
    {
      "id": "J09",
      "actor": "bob",
      "phase": "incident",
      "goal": "Find the incident from beta, reply with a diagnosis, temporarily take the browser offline, recover connectivity, and confirm no duplicate reply is created.",
      "required": true,
      "hard_checks": [
        "diagnosis-visible-on-beta",
        "offline-state-observable",
        "single-reply-after-recovery"
      ]
    },
    {
      "id": "J10",
      "actor": "chrid",
      "phase": "incident",
      "goal": "Find Bob's diagnosis from alpha and publish a customer-safe update that does not disclose internal root-cause details.",
      "required": true,
      "hard_checks": [
        "diagnosis-visible-to-chrid",
        "safe-update-visible",
        "safe-update-does-not-leak-internal-detail"
      ]
    },
    {
      "id": "J11",
      "actor": "david",
      "phase": "authorization",
      "goal": "Sign in on beta and try to discover or open the private Realm without an invitation.",
      "required": true,
      "hard_checks": [
        "private-realm-not-discoverable",
        "private-content-not-readable",
        "realm-existence-not-leaked-beyond-spec"
      ]
    },
    {
      "id": "J12",
      "actor": "alice",
      "phase": "closure",
      "goal": "Confirm Bob's diagnosis and Chrid's safe update are present, edit or pin the final incident summary, reload the product, and verify the final state persists.",
      "required": true,
      "hard_checks": [
        "cross-server-history-converged",
        "final-summary-visible",
        "final-summary-persists-after-reload"
      ]
    }
  ]
}
