{
  "schema_version": "v1",
  "id": "first-realm-continuity",
  "title": "A new user creates a first Realm and preserves message continuity",
  "required_topology": "single",
  "intent": "Exercise the shortest complete product path from first registration through recovery readiness, ordinary Realm bootstrap, message authoring, offline retry, reload, and a fresh sign-in without using hidden mutation APIs.",
  "source_flows": [
    "registration-pcr-genesis",
    "ordinary-realm-creation",
    "message-authoring-seal-sync"
  ],
  "actors": [
    {
      "id": "alice",
      "site": "alpha",
      "role": "new Realm creator"
    }
  ],
  "agent_constraints": {
    "mutation_surface": "visible-ui-only",
    "read_only_oracles_allowed": true,
    "max_attempts_per_checkpoint": 3,
    "allow_testid_locators": false,
    "allow_dom_eval_for_actions": false,
    "require_semantic_snapshot_before_action": true
  },
  "checkpoints": [
    {
      "id": "FRC01",
      "actor": "harness",
      "phase": "topology",
      "goal": "Verify the single-site stack exposes one principal server and one Inkson origin with a writable isolated run state.",
      "required": true,
      "hard_checks": [
        "single-principal-server-present",
        "single-browser-origin-present",
        "run-state-isolated"
      ]
    },
    {
      "id": "FRC02",
      "actor": "alice",
      "phase": "registration",
      "goal": "Register through the visible account flow, confirm the Recovery Key through sensitive input handling, and reach the product Ready state.",
      "required": true,
      "hard_checks": [
        "alice-authenticated",
        "recovery-confirmation-completed",
        "ready-surface-visible",
        "no-secret-in-evidence"
      ]
    },
    {
      "id": "FRC03",
      "actor": "alice",
      "phase": "registration-replay",
      "goal": "Reload during the first authenticated session and verify that onboarding resumes the same identity instead of creating another principal or returning to an unfinished registration step.",
      "required": true,
      "hard_checks": [
        "same-principal-after-reload",
        "ready-state-persists",
        "no-duplicate-onboarding-visible"
      ]
    },
    {
      "id": "FRC04",
      "actor": "alice",
      "phase": "realm-bootstrap",
      "goal": "Create a private encrypted collaboration Realm named for the run with joined history and open its main discussion from normal navigation.",
      "required": true,
      "hard_checks": [
        "realm-created-once",
        "creator-membership-visible",
        "main-discussion-visible",
        "encrypted-private-settings-visible"
      ]
    },
    {
      "id": "FRC05",
      "actor": "alice",
      "phase": "message-authoring",
      "goal": "Publish an initial message, then add a reply, an edit, and a reaction through the visible conversation controls.",
      "required": true,
      "hard_checks": [
        "initial-message-visible",
        "reply-visible",
        "edit-visible-as-new-state",
        "reaction-visible"
      ]
    },
    {
      "id": "FRC06",
      "actor": "alice",
      "phase": "offline-retry",
      "goal": "Take the browser offline, attempt one uniquely tagged message, restore connectivity, and wait for the product to reconcile it.",
      "required": true,
      "hard_checks": [
        "offline-state-observable",
        "pending-message-observable",
        "single-message-after-recovery",
        "no-duplicate-retry-visible"
      ]
    },
    {
      "id": "FRC07",
      "actor": "alice",
      "phase": "reload-continuity",
      "goal": "Reload the Realm after recovery and verify that the main discussion, authored content, edit, reaction, and reconciled message remain available.",
      "required": true,
      "hard_checks": [
        "same-realm-after-reload",
        "timeline-state-persists",
        "reconciled-message-persists",
        "timeline-not-marked-complete-while-loading"
      ]
    },
    {
      "id": "FRC08",
      "actor": "alice",
      "phase": "session-continuity",
      "goal": "Sign out and sign in again through the visible UI, then find the existing Realm without a direct URL and verify its history.",
      "required": true,
      "hard_checks": [
        "sign-out-completed",
        "same-principal-after-sign-in",
        "realm-found-through-navigation",
        "history-visible-after-sign-in"
      ]
    },
    {
      "id": "FRC09",
      "actor": "harness",
      "phase": "read-only-oracle",
      "goal": "Use read-only evidence to confirm that the UI actions produced one principal, one Realm coordinate, creator membership, and one accepted copy of every uniquely tagged message.",
      "required": true,
      "hard_checks": [
        "one-principal-observed",
        "one-realm-coordinate-observed",
        "creator-membership-accepted",
        "unique-message-counts-match"
      ]
    }
  ]
}
